Language_ID,Text_ID,Sentence_Number,ID,Primary_Text,Analyzed_Word,Gloss,Translated_Text,Comment,OTC_ID,LGR_Conformance,Abbreviations
jama1261,20_White_lipped_Peccaries_and_a_Jaguar,1,jama1261a-20_White_lipped_Peccaries_and_a_Jaguar-a1,Hiyama yawa me hiri na me ota tao namaro.,hiyama	yawa	me	hiri	na	me	otaa	tao	na-hamaro,white-lipped peccary(M)	anger(F)	3PL.S	make	AUX.F	3PL.O	1EX.S	shoot	AUX-FP.E.F,"The white-lipped peccaries were fierce, and we killed them with rifles.",,jama1261a,WORD_ALIGNED,"{""PL"": ""plural"", ""AUX"": ""auxiliary"", ""EX"": ""exclusive"", ""FP"": ""far past""}"
jama1261,20_White_lipped_Peccaries_and_a_Jaguar,2,jama1261a-20_White_lipped_Peccaries_and_a_Jaguar-a2,"Me, me me hiyaramaro me ama.",me	me	me	hiyara-hamaro	me	ama,3PL	3PL.O	3PL.S	tell-FP.E.F	3PL.S	SEC,They were telling about them.,,jama1261a,WORD_ALIGNED,"{""PL"": ""plural"", ""FP"": ""far past"", ""SEC"": ""secondary verb""}"
jama1261,20_White_lipped_Peccaries_and_a_Jaguar,3,jama1261a-20_White_lipped_Peccaries_and_a_Jaguar-a3,"Awa hiri ni moni nima ahi, hiyama me ati namaro mati.",awa	hiri	ni	moni	ni-ma	ahi	hiyama	me	ati	na-hamaro	mati,tree(F)	catch_fire	AUX.NFIN	sound	AUX.NOM-like	this	white-lipped peccary(M)	3PL.POSS	voice	AUX-FP.E.F	3PL.POSS,Their voices were like a garden burning.,,jama1261a,WORD_ALIGNED,"{""AUX"": ""auxiliary"", ""NFIN"": ""non-finite"", ""NOM"": ""nominative"", ""PL"": ""plural"", ""POSS"": ""possessor/possessor marker"", ""FP"": ""far past""}"
jama1261,20_White_lipped_Peccaries_and_a_Jaguar,4,jama1261a-20_White_lipped_Peccaries_and_a_Jaguar-a4,"Yama, me makitiri ya me taba me tao onamaro ahi owatino.",yama	me	makitiri	ya	me	taba	me	tao	o-na-hamaro	ahi	owatino,thing(F)	3PL	man	ADJU	3PL.S	be_together.F	3PL.O	shoot	1SG.S-AUX-FP.E.F	then	exclamation,"I was with the men, and I shot some of them.",,jama1261a,WORD_ALIGNED,"{""PL"": ""plural"", ""ADJU"": ""adjunct"", ""SG"": ""singular"", ""AUX"": ""auxiliary"", ""FP"": ""far past""}"
jama1261,20_White_lipped_Peccaries_and_a_Jaguar,5,jama1261a-20_White_lipped_Peccaries_and_a_Jaguar-a5,Sawi nofani tao okana me kabamaro me ama hiyama.,sawi	nofa-hani	tao	o-ka-na	me	kaba-hamaro	me	ama	hiyama,be_present	recently-IP.N.F	shoot	1SG.S-COMIT-AUX.F	3PL.S	eat-FP.E.F	3PL.S	SEC	white-lipped peccary(M),"There was a female peccary that I shot, and they ate it.",,jama1261a,WORD_ALIGNED,"{""IP"": ""immediate past"", ""SG"": ""singular"", ""COMIT"": ""comitative"", ""AUX"": ""auxiliary"", ""PL"": ""plural"", ""FP"": ""far past"", ""SEC"": ""secondary verb""}"
jama1261,20_White_lipped_Peccaries_and_a_Jaguar,6,jama1261a-20_White_lipped_Peccaries_and_a_Jaguar-a6,"Bani me kanaha me iso onahatemaro ama oni, owahariha owa.",bani	me	kanaha	me	iso	o-nahate-hamaro	ama	o-ni	o-ohariha	owa,animal(M)	3PL.S	be_heavy.F	3PL.O	carry_off	1SG.S-daytime-FP.E.F	SEC	1SG.S-BKG.F	1SG.S-be_alone.F	1SG.S,"I carried heavy animals all day long, by myself.",,jama1261a,WORD_ALIGNED,"{""PL"": ""plural"", ""SG"": ""singular"", ""FP"": ""far past"", ""SEC"": ""secondary verb"", ""BKG"": ""backgrounding""}"
jama1261,20_White_lipped_Peccaries_and_a_Jaguar,7,jama1261a-20_White_lipped_Peccaries_and_a_Jaguar-a7,"Hiyama me so onihakosa me bosa okatasa me onakamakimina me, hiyama me kamani me kobo onamakitasimaro ama.",hiyama	me	soo	o-niha-kosa	me	bosa	o-ka-tasa	me	o-na-ka-maki-mina	me	hiyama	me	ka-ma-hani	me	kobo	o-na-maki-tasi-maro	ama,white-lipped peccary(M)	3PL.O	lie	1SG.S-CAUS-middle.F	3PL.O	get_up_early	1SG.S-COMIT-again.F	3PL.O	1SG.S-CAUS-go-following-morning.F	3PL.O	white-lipped peccary(M)	3PL.S	come-back-IP.N.F	3PL.O	meet	1SG.S-AUX-following-again.NOM.F-FP.E.F	SEC,"I left the peccaries in the forest. I got up early because of them, and went after them the next morning. The peccaries came back, and I met up with them again.",,jama1261a,WORD_ALIGNED,"{""PL"": ""plural"", ""SG"": ""singular"", ""CAUS"": ""causative"", ""COMIT"": ""comitative"", ""IP"": ""immediate past"", ""AUX"": ""auxiliary"", ""NOM"": ""nominative"", ""FP"": ""far past"", ""SEC"": ""secondary verb""}"
jama1261,20_White_lipped_Peccaries_and_a_Jaguar,8,jama1261a-20_White_lipped_Peccaries_and_a_Jaguar-a8,Me tao okanamakikimatasamaroke faro.,me	tao	o-ka-na-maki-kima-tasa-hamaro-ke	faaro,3PL.O	shoot	1SG.S-COMIT-AUX-following-two-again-FP.E.F-DECL.F	that.F,Then I shot two more peccaries.,,jama1261a,WORD_ALIGNED,"{""PL"": ""plural"", ""SG"": ""singular"", ""COMIT"": ""comitative"", ""AUX"": ""auxiliary"", ""FP"": ""far past"", ""DECL"": ""declarative""}"
jama1261,20_White_lipped_Peccaries_and_a_Jaguar,9,jama1261a-20_White_lipped_Peccaries_and_a_Jaguar-a9,Yome hiyama me mowa ne yome yama kabani kari.,yomee	hiyama	me	mowa	ne	yomee	yama_kabani	kari,jaguar(M)	white-lipped peccary(M)	3PL.O	fight	AUX.M	jaguar(M)	forest(F)	which.M,There was a jaguar that was after the peccaries.,,jama1261a,WORD_ALIGNED,"{""PL"": ""plural"", ""AUX"": ""auxiliary""}"
jama1261,20_White_lipped_Peccaries_and_a_Jaguar,10,jama1261a-20_White_lipped_Peccaries_and_a_Jaguar-a10,"Yome hiyama me mowa hineno mowa neno, ehene ati yofinemari amane.",yomee	hiyama	me	mowa	hi-na-hino	mowa	na-hino	ehene	ati	yofina-himari	ama-ne,jaguar(M)	white-lipped peccary(M)	3PL.O	fight	OC-AUX-IP.N.M	fight	AUX-IP.N.M	result_of.M	voice	cause_fear-FP.E.M	SEC-BKG.M,"When the jaguar was after the peccaries, their sound was fearsome.",,jama1261a,WORD_ALIGNED,"{""PL"": ""plural"", ""OC"": ""O-construction marker"", ""AUX"": ""auxiliary"", ""IP"": ""immediate past"", ""FP"": ""far past"", ""SEC"": ""secondary verb"", ""BKG"": ""backgrounding""}"
jama1261,20_White_lipped_Peccaries_and_a_Jaguar,11,jama1261a-20_White_lipped_Peccaries_and_a_Jaguar-a11,Yome ene ati ama?,yomee	ehene	ati	ama,jaguar(M)	result_of.M	voice	be,"""Is that the sound of peccaries that have a jaguar after them?""","The NP ehene ati in this sentence and the previous, and ihi ati in the following sentence, are examples of the ""impersonal construction"" discussed in Vogel (2021). The full NP in this sentence is yome ene ati, and it consists of a masculine noun followed by two inalienably possessed nouns. Yome is the possessor of ene, and yome ene is the possessor of ati. But ati actually refers to the voices of the peccaries. The reason is that ehene means 'the one/ones affected by' the possessor, the jaguar. That is, the NP means the voices of the ones affected by the jaguar, i.e. the peccaries. In (12) yama is used instead of yome to refer to the jaguar, and since yama is feminine, the feminine ihi is used instead of the masculine ehene; but the meaning is the same.",jama1261a,WORD_ALIGNED,{}
jama1261,20_White_lipped_Peccaries_and_a_Jaguar,12,jama1261a-20_White_lipped_Peccaries_and_a_Jaguar-a12,Yama ihi ati amake.,yama	ihi	ati	ama-ke,thing(F)	result_of.F	voice	be-DECL.F,"""It is the sound of peccaries that have a jaguar after them.""",,jama1261a,WORD_ALIGNED,"{""DECL"": ""declarative""}"
jama1261,20_White_lipped_Peccaries_and_a_Jaguar,13,jama1261a-20_White_lipped_Peccaries_and_a_Jaguar-a13,"Tera te kakatoma, hiyama me te tonakabone te Noko Wene.",tera	tee	ka-katoma	hiyama	me	tee	to-na-ka-habone	tee	Noko_Wene,2PL.O	2PL.S	COMIT-look_at	white-lipped peccary(M)	3PL.O	2PL.S	away-CAUS-go-INT.F	2PL.S	Noko_Wene(M),"""You be careful when you are going after the peccaries, Noko Wene.""",,jama1261a,WORD_ALIGNED,"{""PL"": ""plural"", ""COMIT"": ""comitative"", ""CAUS"": ""causative"", ""INT"": ""intentive""}"
jama1261,20_White_lipped_Peccaries_and_a_Jaguar,14,jama1261a-20_White_lipped_Peccaries_and_a_Jaguar-a14,Hiyama me ota tonakamatibe.,hiyama	me	otaa	to-na-ka-mata-be,white-lipped peccary(M)	3PL.O	1EX.S	away-CAUS-go-short_time-IMMED.F,"""We are going after the peccaries.""",,jama1261a,WORD_ALIGNED,"{""PL"": ""plural"", ""EX"": ""exclusive"", ""CAUS"": ""causative"", ""IMMED"": ""immediate""}"
jama1261,20_White_lipped_Peccaries_and_a_Jaguar,15,jama1261a-20_White_lipped_Peccaries_and_a_Jaguar-a15,"Me, me ati wawamisamaroke ahi.",me	me	ati	waa-waha-misa-hamaro-ke	ahi,3PL	3PL.POSS	voice	be_located-change-up-FP.E.F-DECL.F	then,They were making a lot of noise.,,jama1261a,WORD_ALIGNED,"{""PL"": ""plural"", ""POSS"": ""possessor/possessor marker"", ""FP"": ""far past"", ""DECL"": ""declarative""}"
jama1261,20_White_lipped_Peccaries_and_a_Jaguar,16,jama1261a-20_White_lipped_Peccaries_and_a_Jaguar-a16,"Hiyama me, ati ita me Noko Wene me me tonaka me ota noki na me, moni yana tonemarine.",hiyama	me	ati	ita	me	Noko_Wene	me	me	to-na-ka	me	otaa	noki	na	me	moni	yana	to-na-himari-ne,white-lipped peccary(M)	3PL.POSS	voice	exist.F	3PL.POSS	Noko_Wene(M)	3PL.O	3PL.S	away-CAUS-go.F	3PL.O	1EX.S	wait_for	AUX.F	3PL.O	sound	start	CH-AUX-FP.E.M-BKG.M,"The voices of the peccaries could be heard. Noko Wene and the others went after them, and we waited for them. The noise of him could be heard.",,jama1261a,WORD_ALIGNED,"{""PL"": ""plural"", ""POSS"": ""possessor/possessor marker"", ""CAUS"": ""causative"", ""EX"": ""exclusive"", ""AUX"": ""auxiliary"", ""CH"": ""change of state"", ""FP"": ""far past"", ""BKG"": ""backgrounding""}"
jama1261,20_White_lipped_Peccaries_and_a_Jaguar,17,jama1261a-20_White_lipped_Peccaries_and_a_Jaguar-a17,Teeeeei rifi moni tonakosamaroke ahi.,rifi	moni	to-na-kosa-hamaro-ke	ahi,rifle(F)	make_sound	CH-AUX-middle-FP.E.F-DECL.F	then,Teei went the sound of a rifle.,,jama1261a,WORD_ALIGNED,"{""CH"": ""change of state"", ""AUX"": ""auxiliary"", ""FP"": ""far past"", ""DECL"": ""declarative""}"
jama1261,20_White_lipped_Peccaries_and_a_Jaguar,18,jama1261a-20_White_lipped_Peccaries_and_a_Jaguar-a18,Yee Noko Wene ati nemari amaka ahi.,yee	Noko_Wene	ati	na-himari	ama-ka	ahi,yee	Noko_Wene(M)	say	AUX-FP.E.M	SEC-DECL.M	then,"""Yee,"" Noko Wene said.",,jama1261a,WORD_ALIGNED,"{""AUX"": ""auxiliary"", ""FP"": ""far past"", ""SEC"": ""secondary verb"", ""DECL"": ""declarative""}"
jama1261,20_White_lipped_Peccaries_and_a_Jaguar,19,jama1261a-20_White_lipped_Peccaries_and_a_Jaguar-a19,Noko Wene yeye ba nemari ama ahi.,Noko_Wene	ye-yee	ba	na-himari	ama	ahi,Noko_Wene(M)	DU.P-yell	without_stopping	AUX-FP.E.M	SEC	then,Noko Wene yelled many times.,,jama1261a,WORD_ALIGNED,"{""DU"": ""dual"", ""AUX"": ""auxiliary"", ""FP"": ""far past"", ""SEC"": ""secondary verb""}"
jama1261,20_White_lipped_Peccaries_and_a_Jaguar,20,jama1261a-20_White_lipped_Peccaries_and_a_Jaguar-a20,Hiyama me kana ni ya kana ni tabemataka.,hiyama	me	kana	ni	ya	kana	ni	taba-himata-ka,white-lipped peccary(M)	3PL.S	run	AUX.NOM.F	ADJU	run	AUX.NFIN	be_together-FP.N.M-DECL.M,It was running with the peccaries as they ran.,,jama1261a,WORD_ALIGNED,"{""PL"": ""plural"", ""AUX"": ""auxiliary"", ""NOM"": ""nominative"", ""ADJU"": ""adjunct"", ""NFIN"": ""non-finite"", ""FP"": ""far past"", ""DECL"": ""declarative""}"
jama1261,20_White_lipped_Peccaries_and_a_Jaguar,21,jama1261a-20_White_lipped_Peccaries_and_a_Jaguar-a21,Sawimataka hiyama me ni ya.,sawi-himata-ka	hiyama	me	ni	ya,be_present-FP.N.M-DECL.M	white-lipped peccary(M)	3PL	to	ADJU,It was with the peccaries.,,jama1261a,WORD_ALIGNED,"{""FP"": ""far past"", ""DECL"": ""declarative"", ""PL"": ""plural"", ""ADJU"": ""adjunct""}"
jama1261,20_White_lipped_Peccaries_and_a_Jaguar,22,jama1261a-20_White_lipped_Peccaries_and_a_Jaguar-a22,"Tao okanena fiya onamakeno Tatiwi onowati kana ni yoto, yome tao kanemari amaka.",tao	o-ka-na-hina	fiya	o-na-make-hino	Tatiwi	o-nowati	kana	ni	yoto	yomee	tao	ka-na-himari	ama-ka,shoot	1SG.S-COMIT-AUX-IRR.M	pass	1SG.S-AUX-following-IP.N.M	Tatiwi(M)	1SG.POSS-behind	run	AUX.NFIN	follow.M	jaguar(M)	shoot	COMIT-AUX-FP.E.M	SEC-DECL.M,"I could have shot it, but I went past it. Tatiwi was running behind me, and he shot the jaguar.",,jama1261a,WORD_ALIGNED,"{""SG"": ""singular"", ""COMIT"": ""comitative"", ""AUX"": ""auxiliary"", ""IRR"": ""irrealis"", ""IP"": ""immediate past"", ""POSS"": ""possessor/possessor marker"", ""NFIN"": ""non-finite"", ""FP"": ""far past"", ""SEC"": ""secondary verb"", ""DECL"": ""declarative""}"
jama1261,20_White_lipped_Peccaries_and_a_Jaguar,23,jama1261a-20_White_lipped_Peccaries_and_a_Jaguar-a23,Hiyama tao kana nakani onemari amane.,hiyama	tao	ka-na	na-kani	o-na-himari	ama-ne,white-lipped peccary(M)	shoot	COMIT-AUX.CONT.M	AUX.M-CNTRFACT	1SG.S-say-FP.E.M	SEC-BKG.M,I thought he had shot a peccary.,,jama1261a,WORD_ALIGNED,"{""COMIT"": ""comitative"", ""AUX"": ""auxiliary"", ""CONT"": ""continuative"", ""CNTRFACT"": ""contrafactual"", ""SG"": ""singular"", ""FP"": ""far past"", ""SEC"": ""secondary verb"", ""BKG"": ""backgrounding""}"
jama1261,20_White_lipped_Peccaries_and_a_Jaguar,24,jama1261a-20_White_lipped_Peccaries_and_a_Jaguar-a24,Oko kana ni tokomake hiyama tao okanamakimaro amake ahi.,o-ka	kana	ni	to-ka-make	hiyama	tao	o-ka-na-maki-maro	ama-ke	ahi,1SG.POSS-POSS	run	AUX.NFIN	away-go-following	white-lipped peccary(M)	shoot	1SG.S-COMIT-AUX-following.NOM-FP.E.F	be-DECL.F	then,"I went running, and I shot a peccary.",,jama1261a,WORD_ALIGNED,"{""SG"": ""singular"", ""POSS"": ""possessor/possessor marker"", ""AUX"": ""auxiliary"", ""NFIN"": ""non-finite"", ""COMIT"": ""comitative"", ""NOM"": ""nominative"", ""FP"": ""far past"", ""DECL"": ""declarative""}"
jama1261,20_White_lipped_Peccaries_and_a_Jaguar,25,jama1261a-20_White_lipped_Peccaries_and_a_Jaguar-a25,Maneo Rowi tao hikana hinemarika ahi.,Maneo_Rowi	tao	hi-ka-na	hi-na-himari-ka	ahi,Maneo_Rowi(M)	shoot	OC-COMIT-AUX.LIST	OC-AUX-FP.E.M-DECL.M	then,"Maneo Rowi shot one, too.",,jama1261a,WORD_ALIGNED,"{""OC"": ""O-construction marker"", ""COMIT"": ""comitative"", ""AUX"": ""auxiliary"", ""LIST"": ""list construction"", ""FP"": ""far past"", ""DECL"": ""declarative""}"
jama1261,20_White_lipped_Peccaries_and_a_Jaguar,26,jama1261a-20_White_lipped_Peccaries_and_a_Jaguar-a26,"Hiyama me ota tao na me ota iso na, kamemarika yome tao kanenoho.",hiyama	me	otaa	tao	na	me	otaa	iso	na	ka-ma-himari-ka	yomee	tao	ka-na-hino-ho,white-lipped peccary(M)	3PL.O	1EX.S	shoot	AUX.F	3PL.O	1EX.S	carry_off	AUX.F	come-back-FP.E.M-DECL.M	jaguar(M)	shoot	COMIT-AUX-IP.N.M-DU.P,"We were carrying the peccaries that we had killed to a gathering point, and he came back after shooting the jaguar.",,jama1261a,WORD_ALIGNED,"{""PL"": ""plural"", ""EX"": ""exclusive"", ""AUX"": ""auxiliary"", ""FP"": ""far past"", ""DECL"": ""declarative"", ""COMIT"": ""comitative"", ""IP"": ""immediate past"", ""DU"": ""dual""}"
jama1261,20_White_lipped_Peccaries_and_a_Jaguar,27,jama1261a-20_White_lipped_Peccaries_and_a_Jaguar-a27,Efe Efe.,Efe	Efe,Efe(M)	Efe(M),"""Efe, Efe.""",,jama1261a,WORD_ALIGNED,{}
jama1261,20_White_lipped_Peccaries_and_a_Jaguar,28,jama1261a-20_White_lipped_Peccaries_and_a_Jaguar-a28,Haa?,haa,huh?,"""Huh?""",,jama1261a,WORD_ALIGNED,{}
jama1261,20_White_lipped_Peccaries_and_a_Jaguar,29,jama1261a-20_White_lipped_Peccaries_and_a_Jaguar-a29,Hiyama tao tikini?,hiyama	tao	ti-ka--ni,white-lipped peccary(M)	shoot	2SG.S-COMIT--BKG.F,"""Did you kill a peccary?""",,jama1261a,WORD_ALIGNED,"{""SG"": ""singular"", ""COMIT"": ""comitative"", ""BKG"": ""backgrounding""}"
jama1261,20_White_lipped_Peccaries_and_a_Jaguar,30,jama1261a-20_White_lipped_Peccaries_and_a_Jaguar-a30,Hiyama tao okane homa ha.,hiyama	tao	o-ka-ne	homa	haa,white-lipped peccary(M)	shoot	1SG.S-COMIT-AUX.M	lie_on_ground.CONT.M	DEM,"""I did kill a peccary, it is lying there.""",,jama1261a,WORD_ALIGNED,"{""SG"": ""singular"", ""COMIT"": ""comitative"", ""AUX"": ""auxiliary"", ""CONT"": ""continuative"", ""DEM"": ""demonstrative""}"
jama1261,20_White_lipped_Peccaries_and_a_Jaguar,31,jama1261a-20_White_lipped_Peccaries_and_a_Jaguar-a31,"Hiyama tao okobise home ama ahi, ati nemarika yome tao kanenoho.",hiyama	tao	o-ka--bise	home	ama	ahi	ati	na-himari-ka	yomee	tao	ka-na-hino-ho,white-lipped peccary(M)	shoot	1SG.S-COMIT--also.M	lie_on_ground.M	SEC	there	say	AUX-FP.E.M-DECL.M	jaguar(M)	shoot	COMIT-AUX-IP.N.M-DU.P,"""I killed a peccary, too, it is lying over there,"" he said. But he had killed a jaguar.",,jama1261a,WORD_ALIGNED,"{""SG"": ""singular"", ""COMIT"": ""comitative"", ""SEC"": ""secondary verb"", ""AUX"": ""auxiliary"", ""FP"": ""far past"", ""DECL"": ""declarative"", ""IP"": ""immediate past"", ""DU"": ""dual""}"
jama1261,20_White_lipped_Peccaries_and_a_Jaguar,32,jama1261a-20_White_lipped_Peccaries_and_a_Jaguar-a32,Totowama omataba.,to-to-awa-ma	o--mata-ba,DU.P-away-see-back	1SG.S--short_time-IMMED.M,"""I will go look at it.""",,jama1261a,WORD_ALIGNED,"{""DU"": ""dual"", ""SG"": ""singular"", ""IMMED"": ""immediate""}"
jama1261,20_White_lipped_Peccaries_and_a_Jaguar,33,jama1261a-20_White_lipped_Peccaries_and_a_Jaguar-a33,Tokomemarihine.,to-ka-ma-himari-hi-ne,away-go-back-FP.E.M-DU.P-BKG.M,He went.,,jama1261a,WORD_ALIGNED,"{""FP"": ""far past"", ""DU"": ""dual"", ""BKG"": ""backgrounding""}"
jama1261,20_White_lipped_Peccaries_and_a_Jaguar,34,jama1261a-20_White_lipped_Peccaries_and_a_Jaguar-a34,"Tokome hiyama me ota iso na me ota so tonihama, hiyama me tori ota itiha, hiyama me ota wete namaro.",to-ka-me	hiyama	me	otaa	iso	na	me	otaa	soo	to-niha--ma	hiyama	me	tori	otaa	itiha	hiyama	me	otaa	wete	na-hamaro,away-go-back.M	white-lipped peccary(M)	3PL.O	1EX.S	carry_off	AUX.F	3PL.O	1EX.S	lie	CH-CAUS--back.F	white-lipped peccary(M)	3PL.POSS	inside.F	1EX.S	take_out.F	white-lipped peccary(M)	3PL.O	1EX.S	tie	AUX-FP.E.F,"He went. We carried the peccaries, and put them together. We gutted the peccaries. We tied the peccaries up.",,jama1261a,WORD_ALIGNED,"{""PL"": ""plural"", ""EX"": ""exclusive"", ""AUX"": ""auxiliary"", ""CH"": ""change of state"", ""CAUS"": ""causative"", ""POSS"": ""possessor/possessor marker"", ""FP"": ""far past""}"
jama1261,20_White_lipped_Peccaries_and_a_Jaguar,35,jama1261a-20_White_lipped_Peccaries_and_a_Jaguar-a35,Ota ni ya ha ni yana tonemarine.,otaa	ni	ya	haa	ni	yana	to-na-himari-ne,1EX	to	ADJU	call	AUX.NFIN	start	CH-AUX-FP.E.M-BKG.M,We heard him start calling.,,jama1261a,WORD_ALIGNED,"{""EX"": ""exclusive"", ""ADJU"": ""adjunct"", ""AUX"": ""auxiliary"", ""NFIN"": ""non-finite"", ""CH"": ""change of state"", ""FP"": ""far past"", ""BKG"": ""backgrounding""}"
jama1261,20_White_lipped_Peccaries_and_a_Jaguar,36,jama1261a-20_White_lipped_Peccaries_and_a_Jaguar-a36,Hee hee.,hee	hee,hey	hey,"""Hey, hey.""",,jama1261a,WORD_ALIGNED,{}
jama1261,20_White_lipped_Peccaries_and_a_Jaguar,37,jama1261a-20_White_lipped_Peccaries_and_a_Jaguar-a37,"Tatiwi ha ka, Tatiwi hiyama tao kanemona ati nari.",Tatiwi	haa	ka	Tatiwi	hiyama	tao	ka-na-himona	ati	na-haari,Tatiwi(M)	call	DECL.M	Tatiwi(M)	white-lipped peccary(M)	shoot	COMIT-AUX-REP.M	say	AUX-IP.E.M,"""Tatiwi is calling, Tatiwi said he shot a peccary.""",,jama1261a,WORD_ALIGNED,"{""DECL"": ""declarative"", ""COMIT"": ""comitative"", ""AUX"": ""auxiliary"", ""REP"": ""reported"", ""IP"": ""immediate past""}"
jama1261,20_White_lipped_Peccaries_and_a_Jaguar,38,jama1261a-20_White_lipped_Peccaries_and_a_Jaguar-a38,Hiyama homa hari ati nematamona.,hiyama	homa	haari	ati	na-himata-mona,white-lipped peccary(M)	lie_on_ground.CONT.M	that_one.M	say	AUX-FP.N.M-REP.M,"""The peccary is lying there,"" he said.",,jama1261a,WORD_ALIGNED,"{""CONT"": ""continuative"", ""AUX"": ""auxiliary"", ""FP"": ""far past"", ""REP"": ""reported""}"
jama1261,20_White_lipped_Peccaries_and_a_Jaguar,39,jama1261a-20_White_lipped_Peccaries_and_a_Jaguar-a39,Hiyama tekamahi.,hiyama	ti-ka-ka-ma-hi,white-lipped peccary(M)	2SG.S-COMIT-come-back-IMP.F,"""Bring the peccary here.""",,jama1261a,WORD_ALIGNED,"{""SG"": ""singular"", ""COMIT"": ""comitative"", ""IMP"": ""imperative""}"
jama1261,20_White_lipped_Peccaries_and_a_Jaguar,40,jama1261a-20_White_lipped_Peccaries_and_a_Jaguar-a40,Hiyama tiwa hinare.,hiyama	tiwa	na-hina-re,white-lipped peccary(M)	carry	AUX-can-NEG.M,"""The peccary can't be carried.""",,jama1261a,WORD_ALIGNED,"{""AUX"": ""auxiliary"", ""NEG"": ""negative""}"
jama1261,20_White_lipped_Peccaries_and_a_Jaguar,41,jama1261a-20_White_lipped_Peccaries_and_a_Jaguar-a41,Hekanakosemataka.,hi-ka-kana-kosa-himata-ka,OC-COMIT-leave-middle-FP.N.M-DECL.M,He left it there.,,jama1261a,WORD_ALIGNED,"{""OC"": ""O-construction marker"", ""COMIT"": ""comitative"", ""FP"": ""far past"", ""DECL"": ""declarative""}"
jama1261,20_White_lipped_Peccaries_and_a_Jaguar,42,jama1261a-20_White_lipped_Peccaries_and_a_Jaguar-a42,Kamemarine.,ka-ma-himari-ne,come-back-FP.E.M-BKG.M,He came.,,jama1261a,WORD_ALIGNED,"{""FP"": ""far past"", ""BKG"": ""backgrounding""}"
jama1261,20_White_lipped_Peccaries_and_a_Jaguar,43,jama1261a-20_White_lipped_Peccaries_and_a_Jaguar-a43,"Kame, kamemarika.",ka-me	ka-ma-himari-ka,come-back.M	come-back-FP.E.M-DECL.M,He came.,,jama1261a,WORD_ALIGNED,"{""FP"": ""far past"", ""DECL"": ""declarative""}"
jama1261,20_White_lipped_Peccaries_and_a_Jaguar,44,jama1261a-20_White_lipped_Peccaries_and_a_Jaguar-a44,Hoo ati nemari.,hoo	ati	na-himari,whew	say	AUX-FP.E.M,"""Whew,"" he said.",,jama1261a,WORD_ALIGNED,"{""AUX"": ""auxiliary"", ""FP"": ""far past""}"
jama1261,20_White_lipped_Peccaries_and_a_Jaguar,45,jama1261a-20_White_lipped_Peccaries_and_a_Jaguar-a45,Ta amari?,himata	ama-ri,what?	be-CQ.F,"""What is it?""",,jama1261a,WORD_ALIGNED,"{""CQ"": ""content question""}"
jama1261,20_White_lipped_Peccaries_and_a_Jaguar,46,jama1261a-20_White_lipped_Peccaries_and_a_Jaguar-a46,Hiyama home ahi.,hiyama	home	ahi,white-lipped peccary(M)	lie_on_ground.NOM.M	there,"""The peccary is lying there.""",,jama1261a,WORD_ALIGNED,"{""NOM"": ""nominative""}"
jama1261,20_White_lipped_Peccaries_and_a_Jaguar,47,jama1261a-20_White_lipped_Peccaries_and_a_Jaguar-a47,Yama i ati saihani tao okana homake ahi.,yama	ihi	ati	sai-hani	tao	o-ka-na	homa-ke	ahi,thing(F)	result_of.F	voice	be_heard-IP.N.F	shoot	1SG.S-COMIT-AUX.F	lie_on_ground-DECL.F	there,"""I shot the jaguar that was causing the commotion of the peccaries, and it is lying there.""",,jama1261a,WORD_ALIGNED,"{""IP"": ""immediate past"", ""SG"": ""singular"", ""COMIT"": ""comitative"", ""AUX"": ""auxiliary"", ""DECL"": ""declarative""}"
jama1261,20_White_lipped_Peccaries_and_a_Jaguar,48,jama1261a-20_White_lipped_Peccaries_and_a_Jaguar-a48,Yome tiwa hinarareka.,yomee	tiwa	na-hina-ra-hare-ka,jaguar(M)	carry	AUX-can-NEG-IP.E.M-DECL.M,"""The jaguar can't be carried.""",,jama1261a,WORD_ALIGNED,"{""AUX"": ""auxiliary"", ""NEG"": ""negative"", ""IP"": ""immediate past"", ""DECL"": ""declarative""}"
jama1261,20_White_lipped_Peccaries_and_a_Jaguar,49,jama1261a-20_White_lipped_Peccaries_and_a_Jaguar-a49,Yome homaka ahi.,yomee	homa-ka	ahi,jaguar(M)	lie_on_ground-DECL.M	there,"""The jaguar is there on the ground.""",,jama1261a,WORD_ALIGNED,"{""DECL"": ""declarative""}"
jama1261,20_White_lipped_Peccaries_and_a_Jaguar,50,jama1261a-20_White_lipped_Peccaries_and_a_Jaguar-a50,Hima e tonakamaho.,hima	ee	to-na-ka-ma-ho,let's_go	1IN.S	away-CAUS-go-back-IMP.M,"""Come on, let's go get it.""",,jama1261a,WORD_ALIGNED,"{""IN"": ""inclusive"", ""CAUS"": ""causative"", ""IMP"": ""imperative""}"
jama1261,20_White_lipped_Peccaries_and_a_Jaguar,51,jama1261a-20_White_lipped_Peccaries_and_a_Jaguar-a51,Yome iti yome itihinemari ama.,yomee	iti	yomee	iti-hina-himari	ama,jaguar(M)	pick_up.M	jaguar(M)	pick_up-can-FP.E.M	SEC,"He tried to pick up the jaguar, but the jaguar couldn't be picked up.",,jama1261a,WORD_ALIGNED,"{""FP"": ""far past"", ""SEC"": ""secondary verb""}"
jama1261,20_White_lipped_Peccaries_and_a_Jaguar,52,jama1261a-20_White_lipped_Peccaries_and_a_Jaguar-a52,"Yome, Noko Mora tiwa hine ota kakame, me hitemarika fahi.",yomee	Noko_Mora	tiwa	hi-ne	otaa	ka-ka-me	me	hi-ite-himari-ka	fahi,jaguar(M)	Noko_Mora(M)	carry	OC-AUX.M	1EX.S	COMIT-come-back.M	3PL.S	OC-skin-FP.E.M-DECL.M	then,"Noko Mora carried the jaguar. We brought it, and they skinned it.",,jama1261a,WORD_ALIGNED,"{""OC"": ""O-construction marker"", ""AUX"": ""auxiliary"", ""EX"": ""exclusive"", ""COMIT"": ""comitative"", ""PL"": ""plural"", ""FP"": ""far past"", ""DECL"": ""declarative""}"
jama1261,20_White_lipped_Peccaries_and_a_Jaguar,53,jama1261a-20_White_lipped_Peccaries_and_a_Jaguar-a53,Ataro Tatiwi ta hinemata awaka.,ataro	Tatiwi	taa	hi-na-himata	awa-ka,skin.M	Tatiwi(M)	sell	OC-AUX-FP.N.M	seem.M-DECL.M,I guess Tatiwi sold its skin.,,jama1261a,WORD_ALIGNED,"{""OC"": ""O-construction marker"", ""AUX"": ""auxiliary"", ""FP"": ""far past"", ""DECL"": ""declarative""}"
jama1261,20_White_lipped_Peccaries_and_a_Jaguar,54,jama1261a-20_White_lipped_Peccaries_and_a_Jaguar-a54,"Yome okiti mono nemata, bono ya sobo si tomaroni noko tao hikanemata.",yomee	okiti	mono	na-himata	bono	ya	sobo	sii	to--maro-ni	noko	tao	hi-ka-na-himata,jaguar(M)	my_grandfather(M)	struggle_with	AUX-FP.N.M	upper_lip.M	ADJU	lead	sit	CH--FP.E.F-BKG.F	face.M	shoot	OC-COMIT-AUX-FP.N.M,"One time when a jaguar attacked my grandfather, he shot it in the face and the shot was embedded in its snout.","There is nominalization in the verb si tomaroni; the finite form would be si tonahamaroni. That is, the auxiliary na would appear, and the tense -hamaro would have the initial -hV syllable (see Dixon 2004:484).",jama1261a,WORD_ALIGNED,"{""AUX"": ""auxiliary"", ""FP"": ""far past"", ""ADJU"": ""adjunct"", ""CH"": ""change of state"", ""BKG"": ""backgrounding"", ""OC"": ""O-construction marker"", ""COMIT"": ""comitative""}"
